,product_title,product_category,review_body,review_headline,star_rating,total_votes,word_length
179,Limefuel Lite Series,Wireless,Just finished using it while on a trip. Loved being able to keep my tablet operating while in flight.  It also indicates how much power is left.  No guessing game here.  Automatically turns off after using.,Perfect,5,0,39
182,Motorola Buds SF500 Universal Bluetooth Stereo Headset,Wireless,"These ear buds work as expected and the battery life is great, however the cords that attach the ear buds to the unit are too short even with the o-rings that secure them rolled back as far as they will go.  They are not so short that I cannot use the headseat, but they are short enough that I sometimes notice an annoying tug.","... buds work as expected and the battery life is great, however the cords that attach the ear buds ...",3,0,65
185,"Nexus 5 Screen Protector, Spigen [AIR CUSHION] [+Screen Shield] Google Nexus 5 Case ULTRA HYBRID Series [1 Premium Japanese Screen Protector Included + 2 Graphics] Scratch Resistant Bumper Case with Clear Back Panel for Nexus 5 - ECO-Friendly Package",Wireless,"It's a good looking case, but the clear window becomes scratched so easily that the case looks old before it's time. The good news is that it works with the charging pads better than my other case.<br /><br />The buttons are smooth on the sides and do not provide any tactile feedback. With gloves on, you cannot tell if you have pressed a button or not. So many times you will turn the screen on and off a couple times in a row. It's a decent case for a decent price.",It's a good looking case,3,0,91
188,LifeProof iPhone 6 - Fre Series,Wireless,"This case help if you just drop your phone, it does not protect prom the water at all, but on the box it says that this case can protect your phone under water around 6 feet deep for a 1 hour. This case is just waist of money. And yeah, they doesn't replace my phone, they just send me a new case. Why do I need a new case if my phone is not working?","This case help if you just drop your phone, ...",1,0,75
189,Skullcandy Soundmine Bluetooth Speaker,Wireless,Sounds pretty darn good. Could use a little more bass but for $20 it blows away everything else I've listened to,Great buy!,4,0,21
192,"Aduro - Apple Certified / MFi - USB to Lightning Long FLAT Charge & Sync Cable fits all Apple Devices with Lightning Connector - iPhone 5 / 5S / 5C / 6 / 6 Plus, iPad 4, iPad Mini, iPad Air, New iPod Touch and Nano (6 Feet / 1.8 Meters)",Wireless,I love this charger! I've been using it for over a month now and it's still intact and working well. I needed a long cable and this is what I've been looking for.,I love this charger!,5,0,33
196,iPhone 5C Case - Funny Vintage Retro Camera Apple iPhone 5C (Cheap IPhone 5) Waterproof TPU Back Cases Covers,Wireless,Love this case. It is made well. I've had it on my iPhone 5C for a long time. I have dropped it several times and it is protected and not broken yet.,great case very durable,5,0,32
197,iTaste MVP3 PRO - 60 Watt - Electronic Charger (60 Watt PRO Version - Silver),Wireless,"I love my Mvp pro 3.0 is a very good battery. There is some this to observe:  1 - I've bought this battery as a kit on Amazon 2 times from other seller and never came with the sub g tank so I bought again from this seller on the option with no tank and retuned the previous items.  2 - it's perfect for most of the tanks but you can read on the manual that will not do coils under 0.4 ohm. So pay attention on that!  3 - it's very easy to use, press the button 3 times to turn it on.  4 - always read the manuals online before to buy it or use it, follow the manual from your coils online to see how much voltage they can handle.  5 - never charge this device on the car or with cheap cables, it's not going to charge cause have protection against bad quality charges.",Excellent battery,5,21,163
198,"HTC One M8 Case, StarCity ® HTC One M8 (Model 2014) Luxury Leather Back Hard Case Cover with Card Holder Snap on Case",Wireless,"Expected the case to be of slightly better quality and the graphics on the phone to be more vivid but when I got it, the case looked very cheap and not to my liking. However, you get what you paid for.",Not as eye-catching in reality.,2,4,41
201,"Powerful Solar Power Bank - Zebora Two Solar Panels 10000mAh Portable Backup Solar Charger Dual USB Power Bank For iPhone 6, 6 Plus, 5s, 5c, 4s, 4, iPods, iPads, Samsung Galaxy Note 3, Note 4, Galaxy S5, S4, S3, LG G3, Nexus, HTC One M8, Gopro Camera, GPS and More Other USB-charged Devices",Wireless,Great for on the go. Its a bit smaller then my S6 works great and charges my phone fast..I have done the charging of two phones at once and did not have to charge them both together.,"Great for on the go, small compact",5,0,37
202,"[Apple MFi Certified] Skiva USBLink (3.2 ft / 1m) Lightning to USB Sync and Charge Cable with Slimmest Connector Head (8.5mm x 4.8mm) for iPhone 6 Plus, iPhone 6, iPhone 5s, iPhone 5c, iPhone 5, iPad Air 2, iPad Air, iPad (4th generation), iPad mini 3, iPad mini with Retina display, iPad mini, iPod touch (5th generation) and iPod nano (7th generation) [Model No.: CB101] - 1 Year Warranty",Wireless,"Just received my Skiva lightning cable and LOVE IT! It is made of a nice sturdy material, not the rubbery kind that usually falls apart quickly. It charged my phone quick and is a nice length. I don't have amazon prime and it was shipped extremely quickly. It even comes with a 1 year warranty.","Quality product, made to last",5,0,55
203,"Anker Portable Multi-Angle Stand for Tablets, e-readers and Smartphones, Compatible with iPhone X/8/8 Plus/7/7 Plus, Samsung Galaxy S8/S7/Note 8, iPad Pro 9.7/10.5/Air/mini, Pixel 2 and More",Wireless,"Arrived very quickly.  Was exactly what I expected.  Works well.  The only thing is you need to push a button to move the leg to the desired position which is fine, but if you do not push the button you could break.  After knowing this it is very easy to set to desired angle.","The only thing is you need to push a button to move the leg to the desired position which is fine, but if you do not push the bu",5,0,58
205,"6ft Durable Hi-Speed Braided Flat Noodle Lightning USB SYNC Cable Charger Cord for iPhone 6 / iPhone 6 Plus / iPhone 5 / iPhone 5C / iPhone 5S (Latest IOS Supported) iPad 4 / iPad Mini / iPad Air / iPad Air 2 / iPod Touch 5th Gen / iPod Nano 7th Gen, - 3PK",Wireless,Works until the accessory is not accepted on the iphone. I got maybe a months worth of use out of these before the iphone started rejecting the plug.,Accessory not compatible,2,2,28
211,LilGadgets Connect+ Premium Volume Limited Wired Headphones with SharePort for Children / Kids,Wireless,"My son loves these, I was impressed with the quality and features. I have had no problems, but the customer support team still reaches out to make sure everyone is enjoying the product.",Great Buy,5,0,33
213,Blue Parrot Xpress Headset - Retail Packaging - Black,Wireless,Returned it worked great but it showed an optional headset attachment which wasn't compatible with this model. I wanted the option to use this either way.,Ear bud only,3,0,26
215,"Leadtry® Water Proof 5000mah Solar Battery Panel Dual USB Port Rain-resistant, Dirtproof and Shockproof Portable Charger Backup External Battery Pack Power Bank Best Tool for Camping, Hiking, Traveling Suitable for Iphone 5s, 5c, 5, Iphone 4s, 4,ipad Air, Mini (Apple Adapters Not Included) Samsung Galaxy S5, S4, S3, S2, Note 3, Note 2, HTC New One, M7, Android Smartphone and Tablets, Window Phone",Wireless,"Did not work at all. I bought 2 of them. They did not hold a charge, and I had it in full sun. Don't buy this product. Not worth it.",no good,1,2,30
216,HTC One 32GB - Phone,Wireless,This phone worked for 1 week fine and after that started to reboot itself and to not recognize the sim card. DO NOT BUY IT FROM THIS COMPANY!!!!!!,This phone worked for 1 week fine and after that started to reboot itself and to ...,1,2,28
219,"Napoer Portable Rectangle Qi Enabled Wireless Charger Inductive Charging Pad Station for LG G4, Nexus 4 / 5 / 6 / 7 (2013), Xperia Z4 / Z3V, Samsung Galaxy S6 / S6 Edge, Note 4, Lumia 920 / 930 and Other Qi Wireless Charging Enabled Smartphones",Wireless,"Does it work? yes. Is it spotty? not the biggest deal, BUT, it makes a horrific high pitched noise when plugged in.If you have good hearing I wouldn't buy unless you want headaches, if your hearing is spotty, go for gold.",the high pitched noise is terrible \.,3,0,41
222,"Anker 6ft Nylon Braided USB Cable with Lightning Connector [Apple MFi Certified] for iPhone 6 / 6 Plus, iPad Air 2 and More (Silver)",Wireless,The original broke after about a month. I emailed Anker and they sent out a brand new one no questions asked within two days of our conversation. This is why i love Anker and always stick with them!,Anker is the only brand for my cable and battery needs!,5,0,38
223,Spigen Slim Armor CS iPhone 6 Plus Case with Slim Dual Layer Wallet Design and Card Slot Holder for iPhone 6S Plus / iPhone 6 Plus,Wireless,"Absolutely adore this case. Cute color, easy storage. Wish the front part of the case was white or same color blue though.",easy storage. Wish the front part of the case ...,5,0,22
227,iFlash 24W / 2.4A + 2.4A (4.8A max) Portable Dual-Port USB Car Charger With Built-in Micro USB Cable Compatible for Samsung Galaxy S6 Plus / S6 Edge / S6 S5 S4 S3 S2 Note 5 4 3 2/ HTC One M9 M8 M7/ Moto X G E/ LG G4 G3 G2 and Extra USB Port for Apple iPhone 6S Plus / 6 Plus / 6S / 6 / 5S 5C 5 4S/ iPad Air Mini 2 3 4 and More (Apple Cable Not Included) - (White),Wireless,"As a phone user, we all come across the issue of our phones dwindling battery life. On the go, it can be an immense problem if you come to the point of minimal battery life, and you don't have the tool to fix that, especially in emergency circumstances. Car chargers like this are of great help, because they allow you to secure your phone's battery life, while not taking up extensive amounts of space that could obstruct your tasks of shifting gears, etc. The product is very durable and well made, and it is not of cheap material. I highly recommend this for people who are on the go, but have important tasks to complete through phone usage.","Portable, durable, handy",5,0,118
228,iClever Charger,Wireless,"My husband and I got this before a trip recently. It was so useful and we are so glad we had it! Whenever our phone batteries got low, we plugged them into this power bank and they charged right up. The unit has a lot of power and is perfect for airplanes or day trips when you don't have constant access to a charger. We didn't have to conserve our phone batteries and were able to use our phones as we normally would, taking pictures, checking email, etc.  It has a little pouch that it fits into which was convenient. It is kind of an awkward size and would be inconvenient to carry around if you don't have a bag or a purse, since you need to have charging cables as well. I always carry large purses, so this wasn't a problem for us.  I like that this power bank has a power switch as well, and it tells you how much battery remains. It has a flashlight on it as well, which I don't think we really have used, but I guess it would be nice for trying to plug in your phone in the dark. We charged this power bank every night (by plugging it into the wall) and always had enough power for 2 smart phones throughout the day. So convenient that you can plug 2 devices in at once.  If you can get this for a good price, I would ABSOLUTELY recommend this portable battery charger to anyone who uses their phone constantly!",Must have!,5,6,260
231,"Moto G Case (1st Gen & 1st Gen with 4G LTE), Rock Me Wireless (TM) 3 items Bundle - Screen Protector, 24K Gold Plating Electromagnetic Waves Blocking Sticker and Heavy Duty Armor Protective Kick Stand Case for Motorola Moto G 1st Generation.",Wireless,I bought this case for my phone. I absolutely love it. I've had it about 6 myhs now and all the lil bling diamonds are all still in tact!!  💜,I absolutely love it. I've had it about 6 myhs now ...,5,1,31
234,Ringke FUSION for Samsung Galaxy S6 Edge,Wireless,"This fits over the Galaxy S6 Edge perfectly, without the added frustration of trying to stuff in an inner rubber bumper. Dropped it several feet while bike riding, and the case has a small dirty dent; but the phone is still in perfect condition. I haven't had the time to make my own backings, but the benefit of being able to change it whenever I want is awesome. While not a game changer; I just wish the website had a digital template to work off of instead of a flimsy paper stencil.",and the case has a small dirty dent; but the phone is still in perfect ...,5,0,92
235,"BLU Studio X, Unlocked Cell Phone",Wireless,"A great phone considering the price! Battery life is somewhat limited, but overall performance is excellent. The upgrade to Lollipop sent flawlessly and the phone has no other real issues.",Fantastic phone for a low price!,4,0,30
236,"Hallomall Nfc-enabled Bluetooth 4.0 Headphones with MIC Compatible with Iphone 6, 6plus, 5s, 5c, 4s, 4, Ipad 2 3 4, Android, Samsung Galaxy, Smart Phones and Other Bluetooth Devices",Wireless,"I really like these headsets, the fit well, and sound really good, the problem is that both pairs I ordered had the same problem, after a bout two weeks of use, they stopped taking a charge resulting in about five minutes of use when powering them on. Too bad.",I really like these headsets,1,0,49
237,"iCarez [Tempered Glass] Screen Protector for LG G3 Easy Install with Lifetime Replacement Warranty [1-Pack,0.3mm 2.5D 9H] - Retail Packaging",Wireless,"First day and so far I'm loving this.  I watched the video, read the directions and had no problem installing it.  The screen looks clear and perfect.",Pretty easy!,5,1,29
238,E LV Ultra Slim Case Premium Semi-transparent Super Lightweight / Exact Fit / Absolutely NO Bulkiness Soft Case for Apple Watch 38mm with 1 Microfiber Cleaning Cloth,Wireless,"The rubber case is thin but you always get what you pay for. If you want your watch just to look cute with minimal protection against scratches then get this one but if you're going to drop your watch then i'd say get a little more hardcore case. I love it though, happy with my purchase! might get a different color!",Its stylish but thin,5,1,61
239,Synthetic Leather Galaxy S6 Sleeve - Thin,Wireless,Quality looks good and prompt postage. You can't argue based on the good price.<br />Would be happy to recommend to others.,Exactly as described,5,0,21
240,High Capacity Portable Backup Battery Charger - Smartphone Battery Pack - Works perfect with iPhone 6 6Plus 5S 5C 5 4S iPad 3 4 Mini Air Samsung Galaxy S5 S5 Edge S4 S3 Note 4 Note 3 & More,Wireless,"I am notorious for losing my charger and having a dead or dying phone.  It can be especially frustrating when I need to make an important phone call or have to leave the house and I have an uncharged phone in the case of an emergency.  Having this backup battery charger can be so convenient!  It is so easy to use.  I plugged it up via usb to my laptop right out of the package to make sure that it was fully charged and then I just tossed it right into my purse.  I always know where it is and when I need to charge my phone with it I can just plug it up the the included cord and drop it right back into my purse.  It does a great job of quickly charging up my phone.  I like the red color!  The charger features a stip of 4 blue lights that light up both when the unit is being charged and when the unit is charging my device.  There is a really neat feature about this power bank that is unlike others I have used, it has a little, but bright, flashlight on it!  Just click the power button twice and it turns on.  I thought that was pretty neat and unique.  Overall, I am happy with the product and its performance.  I received this product complimentary in exchange for my honest and unbiased review.","Small, compact, quick charging",5,0,250
242,"Nolan Tx 3.5 mm (White) Generic Bluetooth Wireless Stereo Music Audio Transmitter Adapter for iPod, Zune, Zen, Sony Walkman, Sansa, Mp3 Players, Portable Music Audio Player, Notebook, Tablet, PSP, Nintendo 3DS, Car Stereo, TV, Blue Ray DVD without Cord Dangle Hassle",Wireless,"Works great with my iPad Mini. Would give it a 5 star except the dang thing doesn't stay put on the top on the mini. Not a major problem, a piece of Double stick foam tape and a rubber band solved the problem. I like it and I use it and would buy again for this price.<br />For the design engineers reading this ... if you had put a small &#34;dummy&#34; tab that fit into the contact slot on the top next to where this plugs in ... it would be perfect and not move about.",Almost perfect.,4,0,96
245,"Samsung Galaxy S6 Case,Utang TPU+PU Leather Case Skin Gel Protective Cover Case for Samsung Galaxy S6",Wireless,"So far i love this case.  Not bulky, protects phone from my clumsiness, and the case fits the phone perfectly.  It's not flashy.  Just right for me.  Delivery of the product was prompt.  No issues.  Quality good.",Great product.,5,0,43
248,Spigen Ultra Hybrid Galaxy S5 Case with Air Cushion Technology and Hybrid Drop Protection for Samsung Galaxy S5 2014 - Mint,Wireless,"This case has done it's job, as I have dropped my phone multiple times and no harm has been done. The only thing I don't care for is how dirty the part around the edge (mint green part) looks. I've tried cleaning it with cleaning products and it appears to be permanently stained.",The only thing I don't care for is how dirty the part around the edge (mint green part) looks,4,0,53
249,PYLE All Weather 5-Inch Trumpet Speaker,Wireless,love how loud it is even with out amp... hooked to cb and scared the hell out of everyone i yelled at .... small so its easy to put anywhere on truck..... id buy more if needed,love how loud it is even with out amp,5,1,37
251,"Amoner(TM) Durable-Series 3 Pack Classic White Extra long 8 pin Reversible USB Charge and Sync Data Cable 6 Feet(2 Meters)- Fits iPhone 6 6 plus, iPhone 5s 5c 5, iPad Air mini mini 2, iPad 4th generation, iPod 5th generation, and iPod nano 7th generation. Premium quality cords for home, office or travel -100% Satisfaction. No Annoying Error Messages. (Compatible with iOS8). Risk free warranty - on",Wireless,It was highly advertised that it doesn't give you any annoying error messages and guess what it does.  The length of the cords are great.,... was highly advertised that it doesn't give you any annoying error messages and guess what it does,3,0,26
255,LG Google Nexus 5 G2 D820 LCD Touch Screen Digitizer Assembly and Frame,Wireless,"Poor quality, would like a refund or a new one sent to me, till the nexus 5 2015 is available","Poor quality, would like a refund or a new ...",1,1,20
257,"Donatech 3ft Micro Charge Data Cable + Wall Charger Set Competible with Galaxy Note 4 , Note Edge, S3, S4, S6, S6 Edge Note 2 (Black)",Wireless,"Can't go wrong with an OEM charger.  In this case, I purchased it as a spare charger for my new Samsung S5",Can't go wrong with an OEM charger. In this ...,5,0,23
258,Genuine Samsung Note 4 Battery Kit,Wireless,"Battery and charger are great. There is no issues with it. I like how fast the charger is. It is well worth the money and the battery is oem. Overall,  great value.",Great value and OEM product.,5,0,33
260,"Unifix-Back Rear Main Camera Replacement Part for iPhone 6 4.7"" (All Carriers) + Tool Kit",Wireless,Bought this part for my friend who has an issue with his camera. He was able to fix it and works better than his original camera.,He was able to fix it and works better than his original camera,5,1,26
261,Samsung Galaxy Note 3 S-View Wallet Cover Folio Case,Wireless,"Cool cover. I really like how it fits the phone. You take the original back case off of the phone and then this one snaps on.  Only problem is that I am worrked it may break along the seam. Other than that, it is good.",Cool cover. I really like how it fits the ...,5,0,46
263,"Thync Calm and Energy Wearable, Limited Edition",Wireless,"I am unable to use it sine I do not have a iPhone. So, I will be returning it shortly.",I am unable to use it sine I do not ...,3,6,20
268,"LG G3 Case, ULAK [3 in 1 Shield] Shock Absorbing Case with Hybrid 3in1 Cover Soft silicone + Hard PC Material Design Case for LG G3 (5.5"" inch) 2014 Release (Blue/Green Wave)",Wireless,"It's a nice design, nice colors, but it does add a significant amount of bulk. And it doesn't feel like the front and back pieces lock securely. It feels like if I were to drop my phone the case would fall apart.<br />I wouldn't buy this product again.",Average,2,0,48
271,GreatShield iSlide Slim-Fit PolyCarbonate Hard Case for Samsung Galaxy S4 S IV,Wireless,"True to color. And the best part is its made out of a good material. It's very durable. I always drop my phone, so this case helps me many times so I didn't have to get a new phone.",And the best part is its made out of a good material,4,1,39
273,"Anker 60W 6-Port USB Wall Charger, PowerPort 6 for iPhone X/ 8/ 7 / 6s / Plus, iPad Pro / Air 2 / mini/ iPod, Galaxy S7 / S6 / Edge / Plus, Note 5 / 4, LG, Nexus, HTC and More",Wireless,"Have bought several of these now, they're awesome. I travel with one, use another in the car when several of us are traveling (car has a AC plugin), have one at my desk, nightstand, and now in my living room.",they're awesome. I travel with one,5,0,40
274,New 1650mAh Battery for Samsung SGH-i897 SGH-i917 D700,Wireless,"Delivery was quick; however, I almost sent it back because it would not charge at all.  I used every charger/cord combo I could find in our house (believe me that is a lot), and just before I gave up, it took the charge and has performed well since. I looked at user reviews for cheaper units, and decided to pay more for this one to get a better product with the Samsung name, model, etc, so I was a little disappointed at first. I did find it odd that the manufacturing date of 2010.08.13 was older than the one that came in my phone 2010.10.27, but now that it works, I guess I'm OK with it.",Its' OK,3,0,117
275,"iPhone 6s Plus Case, JETech Apple iPhone 6/6s Plus Case Shock-Absorption Bumper and Anti-Scratch Clear Back for iPhone 6s 6 Plus 5.5 Inch",Wireless,"Really, really happy with this case, especially for the price paid. It slips on easily and stays on snugly, while still giving my iPhone that sleek feel. Love it!",Very pleased,5,0,29
277,Metra Speaker Harness for Select GM Vehicles,Wireless,"Does not fit a 1995 Blazer 2 door. Both the Amazon car checker and Crutchfield showed this was correct. The correct one for a 1995 Blazer 2 door is Metra 72-4500, they fit the door speakers and the rear quarter panel 6 x 9 speakers. I thought maybe they would fit the dash speakers, they do not fit there either. FYI.",Does not fit 1995 Blazer,3,0,61
278,Vehicle Car GPS Tracker TK103B With Remote Control GSM Alarm SD Card Slot Anti-theft Realtime Tracker Gps103b for GSM GPRS GPS System Tracking Device,Wireless,the gps103b is not working as an alarm. it is responding to sms request but not  to key fob or any input from sensors.,the gps103b is not working as an alarm. it ...,1,0,25
281,ZAGG Case Friendly InvisibleShield Original for iPhone 6 Plus,Wireless,"I bought my glass screen protector, amd it is really disappointing. I don't do things that are particularly hard on phones, just normal adult use and my first one cracked within weeks. I got a replacement for the $5.99 shipping charge, and within weeks, it is cracked in multiple places again. The phone is never without a case either for protection from falls and such. The only conclusion I can draw is the protector itself is flawed in some way","I bought my glass screen protector, amd it is ...",2,0,80
282,"Galaxy S3 Case, S3 Case - ULAK [ Shock Resistant Series ] Hybrid Rubber Case Cover for Samsung Galaxy S3 III i9300 3in1 Hard Plastic +Soft Silicone (Wave-Black Silicone)",Wireless,"Love this case I am even gonna look and see if they h ave any other styles, seems very durable as I very rarely drop my phone but the other day I stood up to greet someone forgetting my phone was on my lap and it fell on to concrete, everything A-Okay !!!!!  I would recommend this case for the simple fact I have been very happy with it and it survived the fall.",Would Recommend !,5,0,75
286,BW 7 inch High Resolution 800*480 TFT Color LCD Car Rear View Camera Monitor Support Rotating The Screen and 2 AV Inputs,Wireless,"The unit I received appeared to be refurbished, as there was no plastic film on the screen and the screen had some minor mars and scratches.  I could have lived with that; however the unit kept randomly turning itself off.  I checked all the connections, and they were tight.  So I am returning it for a replacement, which I hope will function properly.",Appeared Refurbished & Kept Turning Itself Off,2,0,66
287,Cottagecutz Mini Die-Frog 1.2x1.5,Wireless,"I make and sell greeting cards to benefit our local library, and this Cottage Cutz two-piece mini frog die looks cute on my favorite anniversary card.  It would also work well on children's birthday cards.<br /><br />I used 80 lb. card stock to cut this die on my Sizzix Grand Calibur machine,<br /><br />Please see customer image for an example of an A7 (5&#34; x 7&#34;) anniversary card that I made with this die.  The castle die is made by Quick Kutz and the cat tails are cut from another Cottage Cutz die, &#34;Mallard Ducks w/ Cats-tail.&#34;",A cute little two-piece die,4,0,99
