,product_title,product_category,review_body,review_headline,star_rating,total_votes,word_length
0,LG G4 Case Hard Transparent Slim Clear Cover for LG G4,Wireless,"2 issues  -  Once I turned on the circle apps and installed this case,  my battery drained twice as fast as usual.  I ended up turning off the circle apps, which kind of makes the case just a case...  with a hole in it.  Second,  the wireless charging doesn't work.  I have a Motorola 360 watch and a Qi charging pad. The watch charges fine but this case doesn't. But hey, it looks nice.","Looks good, functions meh",2,3,82
1,Selfie Stick Fiblastiq&trade; Extendable Wireless Bluetooth Selfie Stick with built-in Bluetooth Adjustable Phone Holder,Wireless,"I’m embarrassed to admit that until recently, I have had a very negative opinion about “selfie sticks” aka “monopods” aka “narcissticks.” But having reviewed a number of them recently, they’re growing on me. This one is pretty nice and simple to set up and with easy instructions illustrated on the back of the box (not sure why some reviewers have stated that there are no instructions when they are clearly printed on the box unless they received different packaging than I did). Once assembled, the pairing via bluetooth and use of the stick are easy and intuitive. Nothing to it.<br /><br />The stick comes with a USB charging cable but arrived with a charge so you can use it immediately, though it’s probably a good idea to charge it right away so that you have no interruption of use out of the box. Make sure the stick is switched to on (it will light up) and extend your stick to the length you desire up to about a yard’s length and snap away.<br /><br />The phone clamp held the phone sturdily so I wasn’t worried about it slipping out. But the longer you extend the stick, the harder it is to maneuver.  But that will happen with any stick and is not specific to this one in particular.<br /><br />Two things that could improve this: 1) add the option to clamp this in portrait orientation instead of having to try and hold the stick at the portrait angle, which makes it feel unstable; 2) add the opening for a tripod so that this can be used to sit upright on a table for skyping and facetime eliminating the need to hold the phone up with your hand, causing fatigue.<br /><br />But other than that, this is a nice quality monopod for a variety of picture taking opportunities.<br /><br />I received a sample in exchange for my honest opinion.",A fun little gadget,4,0,319
3,"RAVPower® Element 10400mAh External Battery USB Portable Charger (Dual USB Outputs, Ultra Compact Design), Travel Charger for iPhone 6,iPhone 6 plus,iPhone 5, 5S, 5C, 4S, 4, iPad Air, 4, 3, 2, Mini 2 (Apple adapters not included); Samsung Galaxy S5, S4, S3, S2, Note 3, Note 2; HTC One, EVO, Thunderbolt, Incredible, Droid DNA, Motorola ATRIX, Droid, Moto X, Google Glass, Nexus 4, Nexus 5, Nexus 7,",Wireless,Great charger.  I easily get 3+ charges on a Samsung Galaxy 3.  Works perfectly for camping trips or long days on the boat.,Great charger,5,0,25
8,"iPhone 5S Battery Case - iPhone 5 Battery Case , Maxboost Atomic S [MFI Certified] External Protective Battery Charging Case Power Bank Charger All Versions of Apple iPhone 5/5S [Juice Battery Pack]",Wireless,So far so good. It is essentially identical to the one it replaced from another company. That one stopped working after 7 months so I am a bit apprehensive about this one.,So far so good,5,0,32
9,"HTC One M8 Screen Protector, Skinomi TechSkin Full Coverage Screen Protector for HTC One M8 Clear HD Anti-Bubble Film",Wireless,"seems durable but these are always harder to get on right than people make them out to be. also send to curl up at the edges after a while. with today's smartphones, you hardly need screen protectors anyway.",seems durable but these are always harder to get on ...,3,0,38
10,S6 Case - Bear Motion for Galaxy S6 - Premium Back Cover for Samsung Galaxy S6 - Sand (Black),Wireless,"Super thin, lightweight, and non intrusive. Feels amazing, isn't add protective as other cases but I get to enjoy and show off my phone more.","Super thin, lightweight",5,0,25
12,"EZOPower 5-Port Usb Car Charger with 3-Feet Extension Cord, 8-Amp, 40-Watts, Black",Wireless,"I received this on time and its great. I went on a long trip and used it. I have an iPhone 4 s a BLU Android phone and my husband has a small flip phone, it worked great on all of them and I also had a blue tooth I charged on it.",EZOPower,5,0,53
13,iPhone 6S Case &iPhone 6 Case Perfect designed 3D Phone cover for i6/6s Cute bulldog Colourful case for iphone6/6s-PC case,Wireless,Very cheap case. This not protect anything. Very fragil.!! After i got it I went to buy a otter case expensive but worth it.,Very cheap case. This not protect anything. Very ...,1,0,24
18,LilGadgets Connect+ Premium Volume Limited Wired Headphones with SharePort for Children / Kids,Wireless,We love these headphones. We had a pair each for our 2 and 4 year old. They loved them and thought it was great that they could share one device but each have their own set of headphones. Very comfortable as well.,Great headphones for kids,5,0,42
21,Kinivo BTC450 Bluetooth Hands-Free Car Kit for Cars with Aux Input Jack (3.5 mm) - Supports AptX,Wireless,"Initial review after having this Kinivo for 48 hours?  This has been what I've been searching for the last few years trying to use a system to sync up my calls and music.  I've used the motorola tx550 (terrible), Satechi Soundfly BT, and numerous other failed devices.  I was not only able to set this up in literally under a minute, I was later able to completely hide all the wires under my dash which made me even happier.<br /><br />I will periodically update on this device.",I was later able to completely hide all the wires under my dash which made me even happier. I will periodically update on this d,5,0,90
24,"Universal Pu Leather Folding Folio Case Cover with Keyboard for Alcatel Onetouch POP 7s , Pixi 7 , POP 8 , POP 7 , T10, Evo 7 , Evo 7 Hd , Tab 8 Hd, Tab 7 , Tab 7 Hd/ Alcatel One Touch Evo 8hd 8 Inch /",Wireless,"Excellent addition to my alcatel one touch pop 7 ,,, case is attractive and we'll made, the keyboard works great with my tablet .. this product brings my tablet to a new level",Pairs well with my alcatel onetouch pop 7 tablet,5,1,33
25,Bluetooth Headphones TOSHENG In-Ear Wireless Hands-free Phone Earphone Sport Earbuds,Wireless,"Not bad. I LOVE these style of Bluetooth headsets. This one is slightly different from my very first pair I got over a year ago. They are the same shape but this one is not as finished as my current set.  The sound quality is not as clear as my QCY set but is pretty good. It has a nice balance of sound and the bass is sufficient. The sound quality is not like those expensive Beats or bose headphones, but it’s good enough for the price point. These go in the ear so it does block sound out. It blocks noise out so well that when I’m using these in the office, I can get more work done because I don’t hear the chatter of people around me.<br /><br />These use your standard micro usb cables so there’s no fear if you lose the cable that this set comes with. It charges up full in about an hour from dead and right out of the box it charged up in about 30 minutes. The battery life lasts me about 3 work days before needing to be recharged and that includes using it while on the way home from work which is a one hour minimum drive to and from the office.<br /><br />When using this for phone calls, you must leave the left ear piece hanging down around your neck. The microphone is on that earpiece. If you leave it in your ear, the person on the other end will not hear you clearly because the mic will be by your ear. The one thing this set is missing is a clip so you can clip that ear piece onto your collar for phone calls. If you’re like me and always moving around, if the earpieces shuffles around, the person on the phone can hear all the movement.<br /><br />Also, the volume button. It is very temperamental. When I try to hit volume up, I barely touch it and it adjusts volume. When I press down on it adjust volume it has a slow reaction. It’s almost like it works like a touch screen. Holding down the volume up and down buttons while listening to music will skip forward and back on your song list. With very minimal buttons, this is a very easy headset to use. It comes with an instructional booklet complete with photo to show you where the buttons and mic are.<br /><br />It comes with multiple ear pieces so you can change them out to the most comfortable size for you.<br /><br />I was provided a promotional sample for my honest review.s with an instructional booklet complete with photo to show you where the buttons and mic are.<br /><br />It comes with multiple ear pieces so you can change them out to the most comfortable size for you.<br /><br />I was provided a promotional sample for my honest review.",Not bad at all.,4,0,485
26,"Waterproof Case, E LV Universal Waterproof Case For Apple 6 5S, 5, 4S Galaxy S6 Edge, S6, S5, S4 S3, HTC One, iPod touch, MP3 Player and many more (Fits other Smartphones up to 5.1"" diagonal) - IPX8 Certified to 100 Feet",Wireless,"Daughter couldn't go down the river without her phone, so we had to get a case.  This worked perfectly. Not so big that it was hard to carry, and kept the water out!  She keeps it in the bathroom now and uses it when she takes a bath.  Glad it works!",No water here,5,0,54
32,"iPhone 6 Case, MagicMobile® Rugged Dual Durable Armor Case Impact Resistant Shockproof Double Layer Hard Shell with Soft Flexible Black Silicone Skin Cover",Wireless,the only reason i didn't give this 5 stars was that it was super tough to get on and off the phone. other than that it's a solid case and it worked to expectation. i dropped my phone a few times while using this case and the case held up.<br /><br />i was given this case at a discounted rate in return for an unbiased opinion.,... didn't give this 5 stars was that it was super tough to get on and off the phone,4,0,66
33,"iClever 2 in 1 Desktop Apple iWatch Bamboo Wood Stand, Compatible For Both 38mm and 42mm Apple Watch and Iphone7,6plus,6, 5s, 5.",Wireless,"I purchased this as a gift for my brother who just got an Apple watch in July. He loves it! Being a person who works with wood, he especially loved the wood look, very pretty. It works quite well and was well-priced on Amazon.",Beautiful Watch Stand/Charger,5,0,44
36,LANDFOX Dream Catcher Painting Soft TPU Case Cover For iPhone 6 6G 4.7 inch,Wireless,"It's okay. I like the dreamcatcher graphic a lot. The case itself is very thin and the edging on her sides is not seamless. The edges have a small plastic &#34;tail&#34; that is left over from when the case was cut. It's not horrible but it is noticeable and annoying.<br /><br />Not sure what I expected though, afterall its $5.",I like the dreamcatcher graphic a lot,2,0,60
38,LG AKA H788 Mobile Phone (White) - International Version No Warranty,Wireless,"I'm not going to tell you that you should buy this phone, I'll givethe pros and the cons and let you decide for yourself Pros &#34;Durable&#34;    I don't know if Lg of America purposely makes they're phones in America easy to break the screen but this one Right here is a champion. Dropped this on cement, Hard Tile floor, on the sidewalk, and a few Other non carpeted areas. I don't know if it's the construction itself that makes it strong or maybe that LG Of Korea purposely made this phone very strong since it's marketed to teens and younger folks, or maybe it's because every time you dropped the phone instead of it's falling all in one piece and absorbing all the Impact, the back comes off and the battery comes out oftentimes but when you put it back together it works fine. I even had a few front facing dropS so many times I thought oh my God this is it my phone is shattered but I was wrong I am so confident in this phone that I Could do a ear height drop test anytime anywhere and I'm 100 percent sure it won't break and I'm 5ft 10. I don't even have a case on it it's just the screen protector and that's it.  Good Conversation starter (The Eyes)  you have no idea how many conversations have started Because of this.  Me: *Takes my phone out of my pocket to see notifications*  Her: &#34;Omg, does your phone have eyes? Thats sooo cute&#34;  Me:yeah, it's a lil phone from Korea. The Lg aka. check it out it's eye's move too. It even blinks too Her: Thats so adorable, Im ******* by the way.  Continue talking and i ended up getting so many kiks/phone number because of that but i digress. (It's Still Corvette over females doe) A great way to break the ice.  Audio  The Sounds sounds great coming through the speakers no cracking or nothing like that, it's not super loud but if you put it at full volume here and enjoy it even if you're a good distance away. earbuds, it works with every pair of earbuds I have very compatible. Crisp .plus with the LG software their version of the music app you have the option to increase t, the treble, all that. I love that features some songs just don't sound the same without all that bass.let's see what else can I say about the sound? the notifications can be nice and loud. And yeah if you're really into music this is a great phone.  Design   if you are coming from some other company and you're used to the buttons on the sideit'll take a little while but eventually you'll get used to the volume rockers and power button being on the back. and if you don't want to have to deal with that this phone has knock knock you tap on the screen twice to wake it up and then you can enter your password and all that instead of using the little button on the back. and most of the time you can use the littles options At top to adjust the volume but as I said before it's pretty easy To get used to. Plus the phone looks nice, its not ugly.  Call quality The call quality is decent. I thought since this phone was from overseas the call Quality might be off but now it's on point. Texting works normally too .  The speed  if you are used to be mid-range phones, this is quite a little Speedy One.   The Flex factor  lots of people buy Phones As fashion statement, the question is if my  put his galaxy/iPhone/Note/ on the table and you put yo phone next to theirs how would it stack up? I would give this phone a 7. Its pretty nice and if you keep it clean(its easy,every not and again wipe wit a lil rubbing alcohol) you can flex on anyone. Looks like one of them $700 Flagships. If yo guy friends see the eyes however they might clown ya. But that don't matter. The eyes are cool to me and that's all that matter.  Security Lots of options to keep it safe. Bunch of lock options and it has lookout too.at least mine did you might have to install it.  accessories  If you like customization this phone comes with funny lil stickers to put on it. If you older you might not care but i found this cool.  Weight  Its not heavy. I likes this.   OsThe operating system is Kitkat, I personally like KitKat. it gets the job done and it doesn't have too many features that I'll never use thatll just drain my battery.  Memory   16 gigs of internal space . And thats good considering my other phone before this had 8 . Up to 32 gb with a memory card but I used a 64 gb chip and it's worked fine.  Auto focus lazer  Cool feature on the camera very useful. And it can shoot high resolution video  Battery   lasts a while. I can get 6 hours wifi on heavy use but if the brightness is at 100 you lose some up time. And if yiu get a replacement battery you can just switch it out bam.  Cons  Camera isn't highest quality. Kinda grainy.  Not waterproof/Water resistant. Thats how my broke. Not broke but it's messed up pretty bad.   Price. Depending on what color you get this can go up to be 300 dollars, them Amazon vendors tryna rip y'all off this a $200/$250 Phone don't be rash wait till the price go down.  Front facing camera is not that great either but you can see so its not complete trash.  Too much stuff. Too many apps pulling on the ram makes it studder occasionally. Not bad but you'll notice it.   5 inches. I came from 4.7 in, i though well .3 in isn't that big of a jump but I was wrong, sometimes I have difficulty reaching the top of the screen to pull down my notification thing. Not the phone fault my hands just wasn't  for 5 in.   Micro sim. I had a regular sim. But its alright T-Mobile switch it and gave me a new one free.  I lied at the start. You should buy this if you think it's cool",Too Many people Sleeping on this phone,5,2,1110
41,Luxsure Aluminum Metal Case Underwater Waterproof Shockproof Snowproof Dustproof Durable Full Sealed Protection Case Cover with Fingerprint Recognition Touch ID for Apple iPhone 6/6S(Blue),Wireless,"&#34;This a great looking and highly functional case for the iPhone 6.It is a nice solid construction and doesn't add too much bulk to the phone.The case is a little stiff and not that easy to separate.You need to follow the instruction carefully.You should  remove screen protectors at first.<br />You are advised to test the case for waterproofness by placing a piece of paper in the case then dunking it in water. This I did with no problems, the paper was bone dry All the ports are sealed with stoppers so it should be completely sealed.<br />The buttons were still easy to press with the case on and the fingerprint sensor works perfectly;<br />All in all, I like this case and recommend it. &#34;",Great case!,5,18,125
42,Xtreme Bluetooth Wireless Music Receiver  - Black,Wireless,"This is my 8th time buying one of these. Not because they don't last, but because everyone always thinks they are cool and I let them have it. Love the fact that you can turn anything with an AUX input to Bluetooth!",You need to buy one!!!,5,0,42
43,Garmin 2,Wireless,Its annoyingly good at reminding me to get up and move.  Wish it would track 'movement' as well as steps.. and of course I wish it had a vibrate feature. but so far so good.,Vivofit2 review,4,0,36
45,"CamRah iPhone Camera Lens Kit with 3 Universal Lenses, Fisheye Wide Angle and Macro, 2 Lens Clips, Octopus Tripod, storage bag and photo tips",Wireless,I liked the macro lens the most. So sharp! I gave it 4 stars because the wide angle had so much vignette. But this thing is totally worth the money! Works in Sony Xperia z3 compact.,I liked the macro lens the most,4,0,36
49,Spigen Neo Hybrid Galaxy Note 4 Case with Flexible Inner TPU and Reinforced Hard Bumper Frame for Samsung Galaxy Note 4 2014,Wireless,"Fantastic case. Looks slick as can be. The hard buttons remain fully functional. Only reason it doesn't get a 5 is that the case is very difficult to remove, and also, the input for the charger will not fit all chargers. Otherwise, it's a beautiful case.",Fantastic case. Looks slick as can be,4,0,46
51,Jaybird Freedom Sprint Bluetooth Headset  - Storm White,Wireless,"They sounded okay, they had plenty of the skipping that is all too well known with bluetooth headphones, very difficult for me to get the right fit with these. I wanted to like these headphones, but the Blue Buds X were just a hands down winner, the Blue Buds just have too many better features to go with freedoms instead. Durability wise, only time will tell. But these freedoms weren't as good sounding to me, the ear hooks were not as comfortable as I was expecting, I also prefer the Blue Buds due to their smaller size. The price is higher, I bit the bullet and bought them and I am so much happier with them than I was with the cheaper alternatives. I use the Comply Foam Tips and they improve any set of headphones dramatically in My opinion.",I wanted to like these headphones,3,0,140
54,Speck Products SmartFlex Card Case for iPhone 5,Wireless,"Nice product.  Does, as advertised.  Getting used to not carrying a wallet and only carrying necessary with me.",Five Stars,5,0,20
55,Caudabe: The Veil for iPhone 6 (4.7) Premium Ultra Thin Case [Eco-friendly retail packaging],Wireless,"Fits perfectly. Saved my iPhone from getting damaged quite few times, forcing me to keep using.<br />Though the case is a lot slippery i liked it more than the leather one I bought at Apple Store.<br />Looks not compromised.<br />Phone feels lot slimmer. No weight added.<br />Overall great case :)",Though the case is a lot slippery i liked it more than the leather one I bought at ...,5,1,50
56,"HTC Desire 626 Case, HTC Desire 626s Case, ATUS® HTC Desire 626s, HTC Desire 626 Armor Series - Heavy Duty Dual Layer Holster Case Kick Stand with Locking Belt Swivel Clip + Ultra-sensitive Stylus Pen",Wireless,Case is pretty decent nice snug fit on my phone but the kick stand on the phone is really difficult to use.,Case is pretty decent nice snug fit on my phone but the ...,3,0,22
58,Hybridized Clarity Clear back panel,Wireless,Not what I expected at all.  Online description misleading.  Gave it away for my son to play with  don't waste your money,Gave it away for my son to play with don't waste your,1,1,25
60,"Generic 3.5mm Jack Zipper earphone Earbuds with Remote and Mic for Iphone , samsung -Blue",Wireless,"Quality is not great but for the price is completely acceptable. Very cool design and zipper works easily; cloth cord does not tangle much. Bought these mostly for the cool and anti-tangle design, very pleased with it. Would be 5 star if not for the sound quality but I would buy these again if I needed another pair of cheap earbuds to toss in a bag and take out without having to spend ten minutes detangling them.",Good value,4,0,77
61,"Amoner Durable-Series 10ft 8 Pin USB Charging Cable Syncing Cord, 3 Piece - White",Wireless,"Doesn't work on my iPad Air. Would not advised purchasing this product. I have tried different charging bricks and it's the same thing, I get a message that my iPad is not charging.",totally disappointed. Do not buy this product,1,2,33
62,"iPhone 5 Case, iPhone 5S Case, Case Ace® Silicone Slim Protective iPhone 5 5S Case Cover for Apple iPhone 5/5S",Wireless,"This case did not work with aftermarket charger cords; but to clarify they did work with my cords purchased from Apple. I had to notch out the openings a bit to get the aftermarket cord to fit. Otherwise, durable and dependable.",This case did not work with aftermarket charger cords; ...,3,2,41
66,"LG G3 Case, Caseology [Daybreak Series] Slim Fit Shock Absorbent Cover [Lime Green] [Slip Resistant] for G3 - Lime Green",Wireless,Great case! Fits perfectly even with a tempered glass screen protector. It does add bulk to the phone but makes it easier to carry which is a huge plus :) Lime green is a fantastic color.,Great case! Fits perfectly even with a tempered glass ...,5,0,36
68,NakedShield Alcatel One Touch Evolve 2 4037T (Blue Phone Box) Total Hard Armor LifeStyle Phone Case,Wireless,"I'm 50/50 about this product. It's not bad, but I wish it would've been a bit more durable and less thin plastic-y.","It's not bad, but I wish it would've been a bit ...",3,0,22
70,"Anker 40W/8A 5-Port USB Charger PowerPort 5, Multi-Port USB Charger for iPhone SE/6/6 Plus, iPad Air 2/Pro/mini 3, Samsung Galaxy S7/S7 Edge/S6/S6 Edge, LG G5 and More",Wireless,After seeing and using ours a friend asked that I get one for her as well - This is a great charger and a great buying experience.,... one for her as well - This is a great charger and a great buying experience,4,0,27
72,"IMKEY® Premium 10FT Extra Long Gold-Plated Micro USB 2.0 Sync Data Charging Cord Cable For Samsung Galaxy Tab 3 7.0/ 8.0/ 10.1,Samsung Galaxy Tab 4 7.0/ 8.0/ 10.1 , Pro 8.4/ 10.1/ Note 10.1 2014 Edition",Wireless,The part that connects to the tablet broke after the first use. No kidding. The part that is important is actually the weakest part. I was so disappointed. The cord looked so high quality and beautiful.,I was so disappointed. The cord looked so high quality and beautiful,1,0,36
75,Raysun® Premium Ballistic Tempered Glass Screen Protector for Apple iPad Air iPad 4 iPad 3 iPad 2 iPad Mini iPad Mini Retina - 0.33mm 8-9h Hardness,Wireless,Glass shattered during installation. There is no protective cover on the front side of the glass to protect it during installation on the device.  The instructions on the package do not correspond to the actual contents of the box for installation.  Overall poor installation instructions.  I have no idea who the product performs as I never made it that far.<br /><br />I have installed several Zagg glass screen protectors and never had one break before.  This brand is well below the quality of Zagg Glass.  The only reason I tried this brand is that Zagg does not make one for the Kindle HD 7.  A very disappointing result.,Not so great,1,0,114
78,"BESDATA Universal Car Cassette Player Adapter with 3.5mm Male Jack and 2.5mm Plug Adapter for iPod, iPad, iPhone, MP3, Mobil Device, Black",Wireless,"Good cassette adapter.<br />My husband and I just bought a Subaru OUtback 2002 with CD and cassette players.<br />We were afraid to try this to plug our cell phones into the car stereo, because some reviews say that it completely damaged the car sound system, but so far, we've been using for 4 days and , it has been working in a very good way.<br /><br />The only thing that I didn't like, which prevented me for putting 5 stars, it was a small interference sound when I move the cell phone. That is all.","Has been working just fine, with the exception of a small interference sound when I move my cell phone",4,0,95
