,product_title,product_category,review_body,review_headline,star_rating,total_votes,word_length
79,"Universal Waterproof Case, JOTO CellPhone Dry Bag Pouch for Apple iPhone 7 Plus 6S 6 Plus SE 5S, Samsung Galaxy S7, S6 Note 5 4, HTC LG Sony Nokia Motorola up to 6.0"" diagonal",Wireless,Good product.  Please note that it is not a floating case.  They don't claim it is but I somehow was thinking it was.  It is a good price and does what it says.,Good product. Please note that it is not a ...,5,0,36
83,"ASC Single 15"" Subwoofer 1"" MDF Universal Fit Vented Port Sub Box Speaker Enclosure",Wireless,The box was alright but after a short while the box starts falling apart and it rattles about ten times louder than the actual sub. Ruins the listening experience majorly. Ended up putting in screws throughout most of the box and still can not find the source of the rattling exactly.,Not a very suitable option,2,0,51
84,E-PRANCE EP-1512 Cigarette Lighter Power Adapter with 3 DC Sockets,Wireless,"It took a little time for me to write this review because I prefer to try a product out completely over time. I did have a problem with the cable, the camera would shut off when the car was in motion and I would have to screw around with the connector to get it to turn on again, after a few miles it would shut off again, this was corrected when I notified the company which promptly sent me a new cable. The problem now seems to be fixed. About the camera itself...it's a really good little camera, the picture is really clear and the colors are very natural. This camera rivals many more expensive models. Take a look at the YouTube videos, they speak for themselves. The only problem I have (with any of these cameras) is, the setting buttons are really small, for a man's hands that can be a problem, but other than that I really don't have any other complaints with this camera. It does what it was designed to do. The company is really nice to deal with if you do have a problem, like with any electronic device, things can and do go wrong sometimes, but this company responds quickly to rectify a problem which keeps their costumers happy. Over all, I'm very satisfied with my purchase and would recommend this very reasonably priced camera to any one looking to purchase a car camera. When an accident happens, and they do, it's nice to have a visual account to protect yourself. This is a very sensible purchase for anyone.",it's a really good little camera,5,7,265
86,AmazonBasics Apple Certified Lightning to USB Cable - 6 Feet (1.8 Meters) - White,Wireless,"I bought this charger because it was long and apple certified and from Amazon. However, I have had it for about a month and now no longer works because it is says it isn't apple certified which is the way it is described in the name of the product. I hope the company can send me a new iPhone charger because this one is no longer working.",Not Apple Certified,1,0,67
87,Sentey LS-4560 B-trek H9 Bluetooth Wireless Foldable Headphones with Carrying Case,Wireless,"Works as described.  I bought it to have earphones with some noise blocking capability for use on a tractor.  I have ear-bud phones which block noise and these block better with better sound and no more gooey-squishy-sweat in my ear canals.  I have paired it with 2 tablets (one android, one Windows) and my phone all easily.  Good sound quality. Does not block enough outside sound to serve as hearing protection, nor would I expect it to, but it is close and works well for my needs in a tractor which isn't very loud.<br /><br />Pros:  Good sound quality.  Voice notifications lets you know on/off/pairing.  Comfortable (fits fully over my ears).  Range; I tried pairing to my phone when outside ready to hit the tractor and it wouldn't do it....came to realize it was still connected inside to my tablet which I had to go inside to disconnect.  Nice compact case.<br />Cons:  At this price point I can't complain.  The USB charger cable is unique and may be difficult to replace (USB to mic jack). They feel &#34;flimsy&#34; but then that means they are lightweight and comfortable for work-use or long games.<br />Unknowns:  I haven't run the battery dead yet to know run time; at least a few hours.  Microphone; haven't tried it.<br /><br />Bottom line:  when these wear out I will get another pair.  I will probably buy two more for my kids for road trips as they have systematically destroyed the &#34;wire&#34; with each wired set that I have bought them.",Work great and exceeded my expectations with both build and sound quality.  Pleasantly surprised.,5,1,268
92,"Jackery Giant+ Premium 12,000 mAh Dual USB Portable Battery Charger & External Battery Pack (Black)",Wireless,works well.  Can charge my iPad as well as my phone on one charge.  Very handy to take on a trip.,Works well,4,0,23
95,"TechMatte Car Mount MagGrip Windshield and Dashboard Universal Magnetic Car Mount With Device Holder for iPhone 6, 6S, Samsung Galaxy S6, S6 Edge (Black)",Wireless,"I am VERY happy with this holder.  The suction mount and positioning abilities are very high quality.  I use a 5.5 inch screen phone and a thin, hard-shell case.  The thin, metal plate fits easily between the back of my phone and its case, and it holds very firmly on the TechMatte's magnet.  I don't need the gripper portion, although it is also very nice quality.  And while it holds firmly, it also comes off when I want to grab my phone.<br />What I like the most about this mount is the ability to quickly put the phone on, or take it off with one hand and no fumbling about.  You can place the phone on it lengthwise, or straight up and down without difficulty.  Once on, the phone doesn't move while I'm driving through any turns, stops, or bumps.  It's just plain easy, reliable and functional.<br />The mount's suction cup is the best I've ever used -- and I've used many over the years.  It'll hold firm on any windshield, or on a dashboard horizontal pad.  The angle adjustments are easy to use, also high quality, and they hold firmly once in place.<br />This product is absolute proof of &#34;you get what you pay for.&#34;  Sure, you can get a cheaper Chinese knock-off on Ebay...but it won't be anything nearly as good.  I'm sold.  I'll be happy with this system for years.  I will likely purchase more as gifts for my kids this Christmas.",Best Mobile Phone Mount I've Ever Used,5,0,259
97,"iPhone 6 Case, elago S6 Genuine Leather Pocket Case for the iPhone 6 (4.7inch) - eco friendly Retail Packaging - [Limited Edition]",Wireless,Great case...but when i clean my home phone button with awesome spray it touches lil bit of casing frame and all suden change color for that particular part,Great case.,4,0,28
98,"PADDYZI EVA Shockproof Carrying Case/Gopro bags for Gopro Hero 4, 3+, 3, 2, 1 and Accessories - Tailor the Case to Your Unique Needs - Ideal for Travel or Home Storage (Small-(Black))",Wireless,"This case for the GoPro is perfect for two cameras and accessories. It will protect your gear very well without weighing you down, especially if you are traveling.",This case for the GoPro is perfect for two cameras and accessories,5,0,28
100,"TRUE 6,000 mAh ""Smart"" Power Bank (Blue) - Cell Phone Charger - Ultra Sleek with Aluminum 3-in1 cord ($20 Value FREE) and!",Wireless,I ordered two of these about 1.5 months ago. The first one did not work correctly right out of the box. Would not even charge my smart phone one time before running out of juice.<br />On the second unit the power button fell off after only a few weeks. I am very disappointed in these.<br /><br />Update:  After writing the previous review the manufacturer reached out to me and offered to send me replacements.  This was outstanding customer service and in every way makes up for the previous shortcomings.<br /><br />The new chargers both are functioning flawlessly and have neither issue the previous chargers had.  I am not very happy with my purchase.,Poor quality control,5,0,116
102,Vintage Embroidery Floral Case for Apple Iphone 4/4s,Wireless,"I ordered one and it's really pretty I love the decoration but within one day of having it, the corner was cracked and I didn't even drop my phone. So I ordered the free replacement and I had it for about a week an it's already chipped out of the bottom corner and again, I haven't dropped my phone.",I ordered one and it's really pretty I love the decoration but within one day of ...,1,0,59
104,"Galaxy S5 Waterproof Case, iThrough Underwater, Dust Snow Shock Proof Case with Touched Screen Protector, Heavy Duty Protective Carrying Cover Case With a 3.5mm AUX Cable for Galaxy S5",Wireless,"Did not test if it is actually waterproof but this case is very flimsy. The door for the charger port snapped off and the plastic base cracked. I went through two of these in a month. For a better quality case, get an Otterbox. If you want to take pictures underwater, just get a waterproof camera. I wouldn't risk breaking a $600 phone but if you want to...","Made cheaply, does not last - I would not trust putting my phone underwater in this",2,0,68
105,"LG G2 Screen Protector, IQ Shield LiQuidSkin Full Coverage Screen Protector for LG G2 (AT&T,Sprint,T-Mobile,Verizon) HD Clear Anti-Bubble Film - with",Wireless,love this product. Protected my phone for 2 years without peeling off. Had to change my phone and this is the first thing I bought for it. Must have!,love this product,5,0,29
106,"Vibrelli Universal Bike Phone Mount - Fits iPhone X, 8, 8 Plus, 7, 7 Plus, 6, 6 Plus and Android devices",Wireless,"This mount is excellent. Easy to use, stays in place without any slipping (about two weeks of use at this point), and could clearly accommodate most types of phones. Highly recommended.",This mount is excellent. Easy to use,5,1,31
107,"Cootree Lightweight Sweatproof In-Ear Wireless Bluetooth Headphone headsets for Jogger, Running, Sports, Exercise, Workout - Black",Wireless,"I like the style, I have a large head but these fit and stay in place, and they're cheap (notice I said cheap, not inexpensive).<br /><br />If they didn't cost so little (especially for wireless) I would rate lower but for $23 I got what I paid for.  They'll replace my corded headset for doing physical work but only because I've had it with ripping corded phones out of my ears. They won't replace my corded phones while at the office though.<br /><br />The drivers lack bass and there's a slight tunnel effect to the audio.  This is however my first Bluetooth headset so that may be typical. These are meant for wireless convenience and I'll give the sound quality a pass at this price point - they do what is necessary of them.  All of the buttons besides the MFB are conveniently placed and easy to use, but the MFB button is located towards the inside of the earbud instead of the back so you have to almost pull the the earbud out to access it - especially with the rubber &#34;waterproofers&#34; installed.<br /><br />I can't attest yet to the battery life.  If they last 5 hours at a time I'll be happy.<br /><br />The start/stop feature stops working occasionally and I have to unlock my phone before I can stop the music from the headset.  This may be an issue with my phone though, a Moto G first-gen.<br /><br />And finally the rubber buds were all but useless.  In the attached picture you'll see of the buds that came on the headphones (to the farthest right in the picture), one was larger (top) than the other (bottom).  And then the other 2 sets were defective in that the &#34;rim&#34; that attaches to the stem of the headphones is at the front of the earbuds instead of the back.  For instance if you look at the earbuds to the right of the picture (the ones that came on the headset) you'll notice (or not) the black rim is in the back.  But the other 2 sets (left and center) you'll notice the front of the buds are dark - that is the rim which is supposed to be in the back.So these other 2 sets only attach if you put them on backwards, i.e. with the &#34;output&#34; hole onto the stem.  I docked a star for this and thought about RMA'ing but because of shipping/handling charges and the fact that I have other rubber buds from other sets I've purchased in the past, I didn't bother.<br /><br />I was hoping for more but got about what I expected.  My biggest disappointment was in the defective rubber buds.","They're ""Ok""",3,0,459
108,"Bamboo Wireless Charger, YeeSite Qi Charging Pad for Samsung S6 / S6 Edge / S6 Edge Plus / Note 5, Nexus 4 / 5 / 6 / 7 (2013), Nokia Lumia 920, LG Optimus Vu2, HTC 8X / Droid DNA and All Qi-Enabled Devices - 62003",Wireless,"Works and looks great. Charging is a bit slow, but I use it to charge my phone overnight on the night stand.",Works and looks great. Charging is a bit slow,4,0,22
115,Silk Vault Slim Wallet for iPhone 6,Wireless,"Best investments iPhone case wise. No longer do I carry my wallet and cash. Just my DL, American Express and 2 Debit cards.",Puuuuuuuuuurfect!!!,5,0,23
116,Garmin 1,Wireless,"Bought this unit to use in our travel trailer, as I assumed the RV-special features would keep us on the best roads.  Not so!  In just two weeks of use, this thing has told me to &#34;leave the road&#34; twice, and taken me to a gas station that hasn't been a gas station in years.  The first time I used it, I was in a familiar area, and if I hadn't known that the GPS was trying to take me down horse path (literally) I'd have been in trouble. I'm pretty disappointed at the accuracy, and the database is just 'so-so'.  And, it took 14 hours to &#34;update&#34; the database from my USB on my computer, which I did right out of the box.  May have been my PC (I don't think so), but that big of an update made me think it'd be accurate in terms of closed facilities and road accesses.  It's not.<br /><br />The feature that I do like is having rest stops, truck stops and available bathroom stops at the touch of a button (even if they're not terribly accurate), so we're going to keep the thing, rather than return it.<br /><br />I now run both this mediocre thing AND my Google Maps navigation on the smartphone at the same time, 'cause I don't completely trust the Garmin, but Maps doesn't have the one-touch access for stopping points.  Wish there was one unit that did everything we wanted... hard to believe in this age of technology that there isn't... :-(",Pretty Disappointed RVer,3,59,261
117,Virtual Reality Goggles Goggle Tech C1-Glass 3D Glasses for 3D Images & Videos on Android & iOS Smartphones,Wireless,"Good goggles without the frill of the later versions.  I have not compared to other cardboard goggles, but I would guess these are relatively high quality lenses, with plastic frames instead of cardboard.  I did not have any problems using them.  The lack of a visor to block outside light was not an issue.  I did feel a little carsick, though.  Because of the carsickness, I do not regret the lack of a headband.  My arms do not get tired from holding the apparatus for the short periods I feel comfortable using it.  And it feels more natural to be holding it to your face while turning around, rather than relying on a headband to hold cardboard against your face.",Good quality lenses without unnecessary frills,5,6,127
118,"Certified Scable（TM）3 Pack 8 Pin Lightning to USB Sync and Charging Cable Connector for iPhone 6 6 Plus, iPhone 5s 5 5c, iPod Touch 5th, Nano 7th, and iPad 4 Air Air 2 Mini with Authentication Chip Ensures Fast Charging and No Annoying Error Messages",Wireless,We have tried all of the cords in the pack.  They seem to work a couple of times and then they don't charge any longer. Really disappointed!,Really disappointed!,1,0,28
120,JAWBONE Up Move Activity Tracker,Wireless,"My daughter bought this for me, about 2 weeks ago.  This is a really great way to keep track of your activity level, especially since I am now semi-retired.  It gives me an extra nudge to &#34;get up, and keep moving.&#34;  I'm actually enjoying it more than I thought I would.",Even old farts like this!,4,0,54
121,"iPhone 6 Screen Protector, Maxboost [ 3 Pack ] iPhone 6 Tempered Glass Screen Protectors 0.2mm Ballistic Glass For Apple iPhone 6 4.7 inch ONLY and Work with most Protective Case",Wireless,I really liked this product. Very smooth feel - even better than actual screen. Which is strange because you would never say that about a condom. Anywho my opinion changed when a 36&#34; fall from my desk onto carpet caused the screen protector to crack. Very delicate.,Cracked after three weeks.,1,1,47
130,"Retractable iPhone Cable, Apple Certified Lightning Cable 3.3 feet [1 Meter] Charger for iPhone SE / 6s / 6s Plus / 6 / 6 Plus / 5 / iPad / iPad Pro /iPad Air / iPad Mini",Wireless,Works for 3 months and tip of cable stock in my phone. Contact saler told me have to ship the defectid item and then they raplace it. Not worth to buy,Works for 3 months and tip of cable stock in ...,1,4,31
132,For Alcatel OneTouch Idol 3 (5.5),Wireless,"First off, the seller was Great. Item arrived in a very timely manner. The actual materials of this 3 piece case appear to be very rugged. The only exception might be the belt clip (time will tell). However, once you put the silicone gel around the phone, then proceed to slide the phone into the middle bracing part, you have no way to avoid putting stress on the volume rocker and power buttons. You just have to work those buttons into the cutouts. If, like me, you choose to use the belt clip case, inserting and removing the phone can be a challenge. At first, I found myself accidentally taking screen shots because of the pressure being put on the power and volume rocker buttons while sliding the phone in and out of the belt clip case (very tight). Plus the gel covering tends to fold up when pulling phone out. The solution? Well, this is a &#34;flip screen phone,&#34; so I just put it into the belt clip case right side up even though I would rather put it in right side down (The reason: hand down at side to hand up at ear. Results when I pull the phone out, the phone goes from right side down in case to right side up at ear). Overall Pros: 1) Material used appear to be very durable. 2) Kickstand seems to work very well. Overall Cons: 1) Phone is tight in belt clip. 2) Silicone gel gets a lot of friction when putting in and pulling out of belt clip case. 3) Although silicone gel cover has some notches on the sides, feels a little slick. 4) Molded area for earphone plug isn't big enough for a complete flush connection. ... On a sidenote, I accidentally purchased the same two cases from two different sellers, thought I was ordering two DIFFERENT cases (my bad). Once again, not the worst case but could be better. Nothing against either seller, they were great!",Could be better!,3,4,331
134,"LG G4 Case, Diztronic Full Matte Soft Touch Flexible TPU Case for LG G4",Wireless,"I wish the bottom and top edges were a little more rigid, but the case works great. Fits great and very slim.",but the case works great. Fits great and very slim,5,0,22
135,"Fusion Excel® Box of 6 Shields - Cell Phone/Small Appliance EMF Protection. Includes Fusion Excel Authenticity & Registration Card with ""scratch"" ID and Password for Registration at FusionExcelIntl Website.",Wireless,I have been concerned about radiation (EMF and EMR) for some time now. This product blocks the radiation and was inexpensive and effective. I am very satisfied.,Concerned about Radiation EMF / EMR,5,4,27
142,OEM Original iPhone 5 Battery by Falcon iTech with Deluxe magnetic screwdriver repair kit,Wireless,"If I could, I will give it 0 star. I bought 2 days ago and was very happy to receive today. But when I opened it and found it was made in 2013. After installation, the battery was 34% full, 30 minutes later, it became 14% full. Then I used IbackupBot to check and found the battery already has 508 count cycles.  I can accept I bought a brand new defect product, but I can not accept I bought a used product when it was claimed &#34;brand new&#34;.","It is used when it is claimed "" brand new""",1,4,89
143,"iPhone 8 7 6S 6 Screen Protector, amFilm Premium Anti-Glare/Anti-Fingerprint Screen Protector for iPhone 8 7 6/6S 4.7 inch ATT Verizon T-mobile Sprint (3-Pack)",Wireless,"Very nice, smooth to touch. I usually have problems with regular plastic screen protectors. I accidentally scratch those, a bit of it will come off but since the matte is so smooth, it's impossible to scratch. Comes with three also so it's worth it!","Very nice, smooth to touch",5,0,44
148,"Apple iPhone 5C Case, Case Army Scratch-Resistant Slim Clear Case for Apple iPhone 5C | 5G Silicone Crystal Clear Shock-Dispersion Technology Cover with Bumper Rubber Case (Limited",Wireless,Very impressed with this case. It was exactly what I wanted without any of the added bulk other cases seem to have. It went on easy and fits the phone snug. It was exactly what I wanted!,Great case for the price!,5,0,37
161,SwitchEasy NUMBERS TPU Carring Case for iPhone 6 Plus,Wireless,"This is the 3rd time I have purchased the SwitchEasy Numbers case. It provides just enough protection without adding too much bulk to the iPhone 6+.  And it's the only case I know of that covers the power and headphone ports - important for me because I carry my phone in my pocket and the covers keep the lint out.  A little extra work when you want to charge your phone or connect to your car stereo, but totally worth it!","Best Low-Bulk, Port-Covering Case",5,2,83
162,Lg Tone Pro Hbs-750 Wireless Bluetooth Stereo Headphones Black Hbs750,Wireless,Don't waste your money or time buying them. They are fake and the connection is terrible. They don't stay charged long at all.,Terrible!,1,2,23
168,"SoundPEATS Bluetooth Headphones Sport Wireless Earbuds In-Ear Stereo Earphones with Mic (Bluetooth 4.1, 6 Hours Play-time, CVC 6.0 Noise Cancelling, IPX4 Sweatproof )",Wireless,I've purchased many items through Amazon and have never left reviews. This will be my first review in over 5 years because they are so good. I bought them to wear with my phone so I don't have a cord jammed between my fingers.  I compared the prices of other Web sites and went to best buy and these were the cheapest. I was expecting much less than what I received.  Well made with lots of ear fittings.<br />I've used some beats before and these are right up there with the sound quality. Expecially if your watching movies. I use them all the time and am extremely satisfied.,Best headphones I've ever owned,5,0,110
169,Nacodex® 9h Hardness Premium Tempered Glass Screen Protector Real Explosion-proof for Huawei Ascend Mate2 Mate 2 Ii 4g [Ps:the Design Is That the Glass Screen Protector Cover Camera.],Wireless,"This is an almost indestructible plastic cover, and almost no bubbles.  My copy created a permanent bubble around the rear-facing camera, I think because of the camera indention.  The OEM protector was cut around that camera.<br /><br />The first one arrived badly smashed - this is a ridged piece, not a thin film, and someone sat something heavy on it in-transit.  The second was intact and I like it.  It replaced the wimpy one that came on the phone, and within weeks had scratches on it.<br /><br />Forget those three-packs of thin film, this is the kind of protector that works.  Wonder if they make one for a Nikon....",The second was intact and I like it. It replaced the wimpy one that came ...,5,0,114
170,"NOOTPRODUCTS NDT33 Earbuds Mic Stereo, Volume Control and Noise Isolating Headphone, Green",Wireless,"Earphones only lasted a week before the cord started to fray and the wires become exposed.  Before that they were staticky and lost sound in one ear if I moved the device at all.  Unbelievable.  I guess you get what you pay for.  Waiting for a replacement pair of DECENT earphones now, will never buy these again.",Poor quality,1,0,61
171,Rotibox Sweatproof Bluetooth Headband Headphone Headset Earphone Audio Music Headband Speakerphone/Stereo Speaker & Microphone Hands-free for Gym Exercise Fitness Sports Running,Wireless,"There is always a slight buzzing but they are very comfortable to wear, I got them to listen to before I go to sleep so it isn't a huge deal.",Comfortable but has a constant buzzing sound,3,0,30
175,ExosArmor Carbon Series SoftGrip Silicon Shock-Absorbing Armor Holster Belt Clip Case with Screen Protector for Samsung Galaxy S5,Wireless,awful case. the screen protector got dust between it and the adhesive on the protector came loose within 3 weeks. the plastic inner part of the case started cracking and I didn't even drop it yet! I can't return it now that it is broken but i wish i could. Im just going to get an otter box commuter for better quality.,Don't waste your money. Get an Otter Box.,1,1,62
177,Pioneer APPRADIO4/Apple Carplay,Wireless,Great radio for the price. Awesome when it's paired with an apple device. Has a few small quirks but I can only imagine an upcoming update would take care of it. Tons of settings and user friendly.,Great radio for the price,5,0,37
178,"TaoTronics Bluetooth Wireless Earphones Sport Headphones Earbuds Headsets (Bluetooth 4.0, Delicate Sound, Build-in Mic, aptX, CVC 6.0 Noise-Cancelling)-Black",Wireless,"Pro: Size is convenient. Looks cool but not very functional.<br />Cons: Would not stay in my ears, I should not have to struggle just to get it in my ears. It should be as simple as 1,2,3, Go. Not, put it in, possible use a mirror to help with the positioning, hook the ear piece thing and hope it doesn't fall out when you actually start moving. Buttons are tiny, hard to feel when you want to change the volume. Also feels like it is raping my ear canal every time I need to move it ! No thanks, I'll stick with my LG's.",Nope.,1,1,104
